{
  "schema_version": "approved-ticket-context-v1",
  "ticket_id": "TICKET-META-008-PLAN-ORGANIZE-001",
  "revision": 1,
  "ticket_sha256": "02bf4ac10858e6f0d4a74b975c29a86174be714710436643c0be24f45bef07c1",
  "plan_sha256": "674576a4878232de2ab1208dd0b5d8416665d92221b4579554a4d0106c667579",
  "lanes": [
    {
      "lane_id": "TICKET-META-008-PLAN-ORGANIZE-001",
      "role": "business_analyst",
      "phase": "planning",
      "actions": [
        "context.resolve"
      ],
      "touched_paths": [
        "ATOMIC_TICKET.md",
        "plans/plan.md",
        "HANDOFF.md",
        "README.md",
        "HOWTO.md",
        "plans/active/meta-008-support",
        "plans/hlite_design_alignment_audit.md",
        "plans/spark_capability_audit_matrix.md",
        "plans/spark_goal_active_delegation.md",
        "plans/spark_delegate_round_1.md",
        "plans/spark_safety_lane_dispatch_queue.md",
        "plans/spark_go_no_go_checklist.md"
      ],
      "requested_horo_skills": [
        "bsa-doc-skill-management",
        "agile-governance"
      ],
      "source_domain": "business-analysis",
      "risk_flags": [],
      "allowed_child_command_class": "documentation-organization",
      "exclusions": [
        "no-source-write",
        "no-test-write",
        "no-legacy-definition-write",
        "no-commit",
        "no-push",
        "no-deploy"
      ],
      "evidence_refs": []
    }
  ]
}
