{
  "schema_version": "approved-ticket-context-v1",
  "ticket_id": "TICKET-META-008-CI-AZURE-TEST-PERMISSION-BASELINE-001",
  "revision": 1,
  "ticket_sha256": "e1c5a4f2857c6e15a8ccf19d7e91f2a350dded3cfc51a5aa9636f396452d9b7c",
  "plan_sha256": "267937bbba30fc4f883a22cc659c3da671c9f35a83a7efc60daed3d1446afa19",
  "lanes": [
    {
      "lane_id": "TICKET-META-008-CI-AZURE-TEST-PERMISSION-BASELINE-001",
      "role": "qa_tester",
      "phase": "red_baseline",
      "actions": [
        "context.resolve"
      ],
      "touched_paths": [
        "project/tests/test_azure_release.py",
        "plans/test_provenance/ticket-meta-008-ci-azure-permission-baseline.json"
      ],
      "requested_horo_skills": [
        "qa-regression-provenance",
        "qa-e2e-testing"
      ],
      "source_domain": "software-engineering",
      "risk_flags": [
        "ci-permission-requirement-amendment"
      ],
      "allowed_child_command_class": "quality-verification",
      "exclusions": [
        "no-source",
        "no-commit",
        "no-push",
        "no-deploy",
        "no-provider-execution",
        "no-secret-operation"
      ],
      "evidence_refs": []
    }
  ]
}
