{
  "schema_version": "approved-ticket-context-v1",
  "ticket_id": "TICKET-META-008-CI-FIX-001",
  "revision": 1,
  "ticket_sha256": "02bf4ac10858e6f0d4a74b975c29a86174be714710436643c0be24f45bef07c1",
  "plan_sha256": "674576a4878232de2ab1208dd0b5d8416665d92221b4579554a4d0106c667579",
  "lanes": [
    {
      "lane_id": "TICKET-META-008-CI-FIX-001",
      "role": "developer",
      "phase": "implementation",
      "actions": [
        "context.resolve"
      ],
      "touched_paths": [
        ".github/workflows/hf_backend_deploy.yml",
        ".github/workflows/ai_cicd.yml",
        "scripts/verify_release_ci_gates.py",
        "tests/test_release_ci_gates.py",
        "plans/test_provenance/ticket-meta-008-ci-gates-baseline.json"
      ],
      "requested_horo_skills": [
        "sdlc-aisdlc-workflow"
      ],
      "source_domain": "release-engineering",
      "risk_flags": [
        "production-gate-integrity"
      ],
      "allowed_child_command_class": "quality-verification",
      "exclusions": [
        "no-provider-execution",
        "no-secret-operation",
        "no-push",
        "no-deploy"
      ],
      "evidence_refs": []
    }
  ]
}
