{
  "schema_version": "approved-ticket-context-v1",
  "ticket_id": "TICKET-CONTEXT-OPT-001-G-AGY2-REVIEW-003",
  "revision": 1,
  "ticket_sha256": "b86f26a511eab5ae78dea3b17e7e77062e2bcc44068c88dbc0382f92196569dc",
  "plan_sha256": "e8ff2e28c64ad47a06307c8681451569ce4040f9f99841a47e5c742f23eee628",
  "lanes": [
    {
      "lane_id": "TICKET-CONTEXT-OPT-001-G-AGY2-REVIEW-003",
      "role": "code_reviewer",
      "phase": "review",
      "actions": [
        "context.resolve"
      ],
      "touched_paths": [
        "tests/test_context_g_evidence_integrity.py",
        "plans/test_provenance/ticket-context-g-evidence-integrity-baseline-002.json",
        "scripts/render_agent_context_profiles.py",
        "scripts/probe_agent_context_runtime.py",
        "scripts/sync_ai_agent_ecosystem.py",
        "scripts/optimize_codex_skill_budget.py",
        ".agents/agents/devops/agent.json",
        "plans/evidence/context-opt-001/render-check.json",
        "plans/evidence/context-opt-001/budget-report.json",
        "plans/evidence/context-opt-001/runtime-probe-codex.json",
        "plans/evidence/context-opt-001/runtime-probe-claude.json",
        "plans/evidence/context-opt-001/runtime-probe-agy.json",
        "plans/evidence/context-opt-001/antigravity-render-parity.json",
        "scripts/multiagent_prompt_command.py",
        ".agents/config/multiagent_prompt_command.runtime-readonly-v3.yaml",
        "docs/templates/MULTIAGENT_PROMPT_COMMAND.md",
        "plans/evidence/context-opt-001/agy2-review-dispatch-003.json"
      ],
      "requested_horo_skills": [
        "qa-e2e-testing",
        "hf-static-release-verification"
      ],
      "source_domain": "quality-engineering",
      "risk_flags": [
        "synthetic-expired-evidence",
        "unconditional-pass-checks",
        "legacy-agent-contract"
      ],
      "allowed_child_command_class": "quality-verification",
      "exclusions": [
        "no-source-write",
        "no-test-write",
        "no-secret-operations",
        "no-account-config-write",
        "no-push",
        "no-deploy",
        "no-guard-bypass"
      ],
      "evidence_refs": []
    }
  ]
}
