{
  "schema_version": "approved-ticket-context-v1",
  "ticket_id": "TICKET-FIX-HANDOFF-FIXTURE-001",
  "revision": 1,
  "ticket_sha256": "8573abb7b1e175e6c6f65810d49d6d9925e9a2f742bf095ac62b72643ecf45a9",
  "plan_sha256": "6ab177b5b57d93f36cc31d47ab8b5ee30cb2dc51d0ee70c05181244cebbb7aa8",
  "lanes": [
    {
      "lane_id": "TICKET-FIX-HANDOFF-FIXTURE-001",
      "role": "qa_tester",
      "phase": "red_baseline",
      "actions": [
        "context.resolve"
      ],
      "touched_paths": [
        "tests/fixtures/context_handoff/codex/hooks_config.json",
        "plans/test_provenance/ticket-fix-handoff-fixture-001.json",
        ".codex/hooks.json",
        "tests/test_context_handoff_hooks.py"
      ],
      "requested_horo_skills": [
        "qa-e2e-testing"
      ],
      "source_domain": "software-engineering",
      "risk_flags": [],
      "allowed_child_command_class": "reviewed-local-baseline-commit",
      "exclusions": [
        "no-production-config-write",
        "no-source-write",
        "no-push",
        "no-deploy",
        "no-network"
      ],
      "evidence_refs": []
    }
  ]
}
