{
  "schema_version": "approved-ticket-context-v1",
  "ticket_id": "TICKET-TOOLING-PROV-GUARD-001-BASELINE-COMMIT",
  "revision": 1,
  "ticket_sha256": "7b8f642c953980e26d5750b5d2ee3b045bb0578adf4738fb7bcd69adbbb1ff67",
  "plan_sha256": "267937bbba30fc4f883a22cc659c3da671c9f35a83a7efc60daed3d1446afa19",
  "lanes": [
    {
      "lane_id": "TICKET-TOOLING-PROV-GUARD-001-BASELINE-COMMIT",
      "role": "devops",
      "phase": "review",
      "actions": [
        "context.resolve"
      ],
      "touched_paths": [
        "tests/test_provenance_governance_extensions.py",
        "plans/test_provenance/ticket-meta-008-provenance-extensions-baseline.json",
        "scripts/test_provenance_guard.py",
        "plans/evidence/meta-008-remediation/provenance-guard-review.json"
      ],
      "requested_horo_skills": [
        "devops-deployment",
        "hf-static-release-verification"
      ],
      "source_domain": "software-engineering",
      "risk_flags": [
        "exact-test-only-local-commit"
      ],
      "allowed_child_command_class": "local-baseline-commit",
      "exclusions": [
        "no-source",
        "no-push",
        "no-deploy",
        "no-provider-execution",
        "no-secret-operation",
        "no-review-receipt-stage"
      ],
      "evidence_refs": []
    }
  ]
}
